{
  "protocol": "asr-local-workflow",
  "protocol_version": 2,
  "kind": "request",
  "request_id": "req_secret_summary_001",
  "method": "secret.provide",
  "params": {
    "workflow_id": "wf_001",
    "expected_attempt_id": "att_001",
    "secret_request_id": "secret_req_summary_001",
    "profile_id": "summary-profile-uuid",
    "profile_version": 4,
    "credential_ref": "credential://summary/summary-profile-uuid",
    "purpose": "summary_api",
    "provider_binding_sha256": "hex-digest",
    "secret": "ephemeral-test-secret",
    "lease_scope": "attempt"
  }
}
