{
  "protocol": "asr-local-workflow",
  "protocol_version": 2,
  "kind": "response",
  "request_id": "req_revision_001",
  "operation_id": "op_revision_001",
  "ok": true,
  "result": { "artifact": { "artifact_id": "artifact-002", "kind": "transcript_markdown", "revision": 2, "origin": "user_edited", "derived_from_artifact_id": "transcript-artifact-001", "input_artifact_ids": [], "stale": false, "path": "D:\\outputs\\customer-interview--wf_001\\transcript--r2.md", "size_bytes": 18320, "sha256": "hex-digest", "created_at": "2026-07-10T12:10:00Z" }, "snapshot": {} }
}
