{
  "protocol": "asr-local-workflow",
  "protocol_version": 2,
  "kind": "request",
  "request_id": "req_secret_cloud_001",
  "method": "secret.provide",
  "params": {
    "workflow_id": "wf_002",
    "expected_attempt_id": "att_002",
    "secret_request_id": "secret_req_cloud_001",
    "profile_id": "cloud-profile-uuid",
    "profile_version": 2,
    "credential_ref": "credential://cloud/cloud-profile-uuid",
    "purpose": "cloud_asr",
    "provider_binding_sha256": "hex-digest",
    "secret": "ephemeral-test-secret",
    "lease_scope": "attempt"
  }
}
