{
  "protocol": "asr-local-workflow",
  "protocol_version": 2,
  "kind": "response",
  "request_id": "req_submit_001",
  "operation_id": "op_submit_001",
  "ok": true,
  "result": {
    "created": true,
    "deduplicated": false,
    "snapshot": {
      "snapshot_version": 2,
      "workflow_id": "wf_001",
      "sequence": 1,
      "spec": {},
      "status": "queued",
      "stage": "queued",
      "attempt": {
        "attempt_id": "att_001",
        "number": 1,
        "stage_attempts": { "transcription": 0, "summary": 0, "writing_final": 0 }
      },
      "progress": { "stage_ratio": 0, "overall_ratio": 0, "queue_position": 0 },
      "control": { "pending_action": null },
      "runtime_plan": null,
      "artifacts": [],
      "recovery": { "recommended_retry_stage": null, "interrupted_attempt_id": null },
      "last_error": null,
      "timestamps": {
        "created_at": "2026-07-10T12:00:00Z",
        "updated_at": "2026-07-10T12:00:00Z",
        "started_at": null,
        "completed_at": null
      }
    }
  }
}
