{
  "protocol": "asr-local-workflow",
  "protocol_version": 2,
  "kind": "event",
  "event": "workflow.event",
  "payload": {
    "workflow_id": "wf_001",
    "attempt_id": "att_001",
    "sequence": 12,
    "occurred_at": "2026-07-10T12:04:00Z",
    "type": "credentials_required",
    "stage": "summarizing",
    "data": {
      "secret_request_id": "secret_req_summary_001",
      "profile_id": "summary-profile-uuid",
      "profile_version": 4,
      "credential_ref": "credential://summary/summary-profile-uuid",
      "purpose": "summary_api",
      "provider_binding_sha256": "hex-digest",
      "expires_at": "2026-07-10T12:05:00Z"
    },
    "state": {
      "snapshot_version": 2,
      "workflow_id": "wf_001",
      "sequence": 12,
      "spec": {},
      "status": "waiting_for_secret",
      "stage": "summarizing",
      "attempt": { "attempt_id": "att_001", "number": 1, "stage_attempts": { "transcription": 1, "summary": 1, "writing_final": 0 } },
      "progress": { "stage_ratio": 0.1, "overall_ratio": 0.7, "queue_position": null },
      "control": { "pending_action": null },
      "runtime_plan": null,
      "artifacts": [],
      "recovery": { "recommended_retry_stage": null, "interrupted_attempt_id": null },
      "last_error": null,
      "timestamps": { "created_at": "2026-07-10T12:00:00Z", "updated_at": "2026-07-10T12:04:00Z", "started_at": "2026-07-10T12:00:03Z", "completed_at": null }
    }
  }
}
