{
  "protocol": "asr-local-workflow",
  "protocol_version": 2,
  "kind": "event",
  "event": "workflow.event",
  "payload": {
    "workflow_id": "wf_002",
    "attempt_id": "att_002",
    "sequence": 4,
    "occurred_at": "2026-07-10T12:04:00Z",
    "type": "credentials_required",
    "stage": "transcribing",
    "data": {
      "secret_request_id": "secret_req_cloud_001",
      "profile_id": "cloud-profile-uuid",
      "profile_version": 2,
      "credential_ref": "credential://cloud/cloud-profile-uuid",
      "purpose": "cloud_asr",
      "provider_binding_sha256": "hex-digest",
      "expires_at": "2026-07-10T12:05:00Z"
    },
    "state": {
      "snapshot_version": 2,
      "workflow_id": "wf_002",
      "sequence": 4,
      "spec": {},
      "status": "waiting_for_secret",
      "stage": "transcribing",
      "attempt": { "attempt_id": "att_002", "number": 1, "stage_attempts": { "transcription": 1, "summary": 0, "writing_final": 0 } },
      "progress": { "stage_ratio": 0.4, "overall_ratio": 0.2, "queue_position": null },
      "control": { "pending_action": null },
      "runtime_plan": null,
      "artifacts": [],
      "recovery": { "recommended_retry_stage": null, "interrupted_attempt_id": null },
      "last_error": null,
      "timestamps": { "created_at": "2026-07-10T12:00:00Z", "updated_at": "2026-07-10T12:04:00Z", "started_at": "2026-07-10T12:00:03Z", "completed_at": null }
    }
  }
}
